<?xml version="1.0" encoding="UTF-8"?>

<ventas xmlns:xsi="http://www.w3.org/2001/XMLSchema-instance" 
xsi:noNamespaceSchemaLocation="baseDeDatos.xsd">

        <clientes idCliente="2">
            <nombre>Manuel</nombre>
            <apellido1>Gomez</apellido1>
            <apellido2>Rodriguez</apellido2>
            <ciudad>Santander</ciudad>
            <categoria>01</categoria>
        </clientes>
        <comerciales idComercial="3">
            <nombre>Manuel</nombre>
            <apellido1>Gomez</apellido1>
            <apellido2>Rodriguez</apellido2>
            <comision>10000</comision>
        </comerciales>
        <pedidos idPedido="1" idCliente="2" idComercial="3">
            <total>100</total>
            <fecha>1111-11-11</fecha>
        </pedidos>
</ventas>
